{
  "assertion_version": "0.1.0",
  "assertion_id": "example-recognition-assertion-2026-02",
  "asserted_at": "2026-02-22T00:00:00Z",
  "issuer": {
    "name": "Example TRQP Registry Operator",
    "registry_base_url": "https://registry.example.org",
    "contact": "security@example.org"
  },
  "subject": {
    "type": "auditor",
    "name": "Example Audit Firm",
    "identifier": "https://auditor.example.com"
  },
  "recognition": {
    "type": "recognizes-auditor",
    "basis": "Annual audit against published control objectives for high-consequence deployments",
    "scope": "Applies to AL3/AL4 assurance claims",
    "effective_from": "2026-01-01T00:00:00Z",
    "expires_at": "2027-01-01T00:00:00Z",
    "evidence": [
      "artifact://audit-report/2025",
      "https://example.org/policies/audit-scope"
    ]
  },
  "signature": {
    "type": "external-detached",
    "value": "artifact://signatures/example-recognition-assertion-2026-02.sig"
  }
}
